{
  "benchmark_id": "public-5gc-golden-captures",
  "cases": [
    {
      "adjudication_required": false,
      "baseline_supported": true,
      "case_id": "public-5gc-access-plmn-negative",
      "comparison_eligibility": "ELIGIBLE",
      "comparison_status": "DOMAIN_COVERAGE_GAP",
      "frame_delta": null,
      "human_boundary_frame": 7,
      "human_status": "BOUNDARY_OBSERVED",
      "layer_attribution": "DOMAIN_COVERAGE",
      "recommended_next_action": "EXPAND_FUTURE_SCOPE",
      "skill_boundary_frame": null,
      "skill_status": "NO_DOMAIN_INPUTS"
    },
    {
      "adjudication_required": false,
      "baseline_supported": true,
      "case_id": "public-5gc-access-plmn-recovery",
      "comparison_eligibility": "ELIGIBLE",
      "comparison_status": "DOMAIN_COVERAGE_GAP",
      "frame_delta": null,
      "human_boundary_frame": null,
      "human_status": "NO_SUPPORTED_ABNORMAL_BOUNDARY_OBSERVED",
      "layer_attribution": "DOMAIN_COVERAGE",
      "recommended_next_action": "EXPAND_FUTURE_SCOPE",
      "skill_boundary_frame": null,
      "skill_status": "NO_DOMAIN_INPUTS"
    },
    {
      "adjudication_required": false,
      "baseline_supported": true,
      "case_id": "public-5gc-access-tai-negative",
      "comparison_eligibility": "ELIGIBLE",
      "comparison_status": "DOMAIN_COVERAGE_GAP",
      "frame_delta": null,
      "human_boundary_frame": 7,
      "human_status": "BOUNDARY_OBSERVED",
      "layer_attribution": "DOMAIN_COVERAGE",
      "recommended_next_action": "EXPAND_FUTURE_SCOPE",
      "skill_boundary_frame": null,
      "skill_status": "NO_DOMAIN_INPUTS"
    },
    {
      "adjudication_required": false,
      "baseline_supported": true,
      "case_id": "public-5gc-access-tai-recovery",
      "comparison_eligibility": "ELIGIBLE",
      "comparison_status": "DOMAIN_COVERAGE_GAP",
      "frame_delta": null,
      "human_boundary_frame": null,
      "human_status": "NO_SUPPORTED_ABNORMAL_BOUNDARY_OBSERVED",
      "layer_attribution": "DOMAIN_COVERAGE",
      "recommended_next_action": "EXPAND_FUTURE_SCOPE",
      "skill_boundary_frame": null,
      "skill_status": "NO_DOMAIN_INPUTS"
    },
    {
      "adjudication_required": true,
      "baseline_supported": true,
      "case_id": "public-5gc-auth-negative",
      "comparison_eligibility": "ELIGIBLE",
      "comparison_status": "PROCEDURE_MATCH_STAGE_DIFFERENCE",
      "frame_delta": 0,
      "human_boundary_frame": 11,
      "human_status": "BOUNDARY_OBSERVED",
      "layer_attribution": "DOMAIN",
      "recommended_next_action": "CORRECT_DOMAIN_MODEL",
      "skill_boundary_frame": 11,
      "skill_status": "SELECTED"
    },
    {
      "adjudication_required": true,
      "baseline_supported": true,
      "case_id": "public-5gc-auth-recovery",
      "comparison_eligibility": "ELIGIBLE",
      "comparison_status": "NEEDS_ADJUDICATION",
      "frame_delta": null,
      "human_boundary_frame": null,
      "human_status": "NO_SUPPORTED_ABNORMAL_BOUNDARY_OBSERVED",
      "layer_attribution": "DOMAIN",
      "recommended_next_action": "CORRECT_DOMAIN_MODEL",
      "skill_boundary_frame": null,
      "skill_status": "NO_ABNORMAL_BOUNDARY_OBSERVED"
    },
    {
      "adjudication_required": true,
      "baseline_supported": true,
      "case_id": "public-5gc-baseline-lifecycle",
      "comparison_eligibility": "ELIGIBLE",
      "comparison_status": "NEEDS_ADJUDICATION",
      "frame_delta": null,
      "human_boundary_frame": null,
      "human_status": "NO_SUPPORTED_ABNORMAL_BOUNDARY_OBSERVED",
      "layer_attribution": "DOMAIN",
      "recommended_next_action": "CORRECT_DOMAIN_MODEL",
      "skill_boundary_frame": null,
      "skill_status": "NO_ABNORMAL_BOUNDARY_OBSERVED"
    },
    {
      "adjudication_required": true,
      "baseline_supported": true,
      "case_id": "public-5gc-baseline-user-plane",
      "comparison_eligibility": "ELIGIBLE",
      "comparison_status": "NEEDS_ADJUDICATION",
      "frame_delta": null,
      "human_boundary_frame": null,
      "human_status": "NO_SUPPORTED_ABNORMAL_BOUNDARY_OBSERVED",
      "layer_attribution": "DOMAIN",
      "recommended_next_action": "CORRECT_DOMAIN_MODEL",
      "skill_boundary_frame": null,
      "skill_status": "NO_ABNORMAL_BOUNDARY_OBSERVED"
    },
    {
      "adjudication_required": false,
      "baseline_supported": true,
      "case_id": "public-5gc-dnn-negative",
      "comparison_eligibility": "DEGRADED",
      "comparison_status": "CAPTURE_LIMITATION",
      "frame_delta": null,
      "human_boundary_frame": null,
      "human_status": "INSUFFICIENT_EVIDENCE",
      "layer_attribution": "CAPTURE",
      "recommended_next_action": "NO_CHANGE",
      "skill_boundary_frame": null,
      "skill_status": "NO_ABNORMAL_BOUNDARY_OBSERVED"
    },
    {
      "adjudication_required": true,
      "baseline_supported": true,
      "case_id": "public-5gc-dnn-recovery",
      "comparison_eligibility": "ELIGIBLE",
      "comparison_status": "NEEDS_ADJUDICATION",
      "frame_delta": null,
      "human_boundary_frame": null,
      "human_status": "NO_SUPPORTED_ABNORMAL_BOUNDARY_OBSERVED",
      "layer_attribution": "DOMAIN",
      "recommended_next_action": "CORRECT_DOMAIN_MODEL",
      "skill_boundary_frame": null,
      "skill_status": "NO_ABNORMAL_BOUNDARY_OBSERVED"
    },
    {
      "adjudication_required": false,
      "baseline_supported": true,
      "case_id": "public-5gc-external-path-negative",
      "comparison_eligibility": "ELIGIBLE",
      "comparison_status": "OUT_OF_SCOPE",
      "frame_delta": null,
      "human_boundary_frame": null,
      "human_status": "OUTSIDE_CURRENT_CORENET_SCOPE",
      "layer_attribution": "OUT_OF_SCOPE",
      "recommended_next_action": "EXPAND_FUTURE_SCOPE",
      "skill_boundary_frame": null,
      "skill_status": "NO_DOMAIN_INPUTS"
    },
    {
      "adjudication_required": false,
      "baseline_supported": true,
      "case_id": "public-5gc-external-path-recovery",
      "comparison_eligibility": "ELIGIBLE",
      "comparison_status": "DOMAIN_COVERAGE_GAP",
      "frame_delta": null,
      "human_boundary_frame": null,
      "human_status": "NO_SUPPORTED_ABNORMAL_BOUNDARY_OBSERVED",
      "layer_attribution": "DOMAIN_COVERAGE",
      "recommended_next_action": "EXPAND_FUTURE_SCOPE",
      "skill_boundary_frame": null,
      "skill_status": "NO_DOMAIN_INPUTS"
    },
    {
      "adjudication_required": true,
      "baseline_supported": true,
      "case_id": "public-5gc-registration-resync",
      "comparison_eligibility": "ELIGIBLE",
      "comparison_status": "NEEDS_ADJUDICATION",
      "frame_delta": null,
      "human_boundary_frame": null,
      "human_status": "NO_SUPPORTED_ABNORMAL_BOUNDARY_OBSERVED",
      "layer_attribution": "DOMAIN",
      "recommended_next_action": "CORRECT_DOMAIN_MODEL",
      "skill_boundary_frame": null,
      "skill_status": "NO_ABNORMAL_BOUNDARY_OBSERVED"
    }
  ],
  "corenet_commit": "7599cea1e3f4527d7f6992763f9b2f5063cc58b2",
  "external_source_commit": "82934c2cc231540fa425e48177d4bed33210bfc1",
  "generated_at": "2026-10-19T15:42:23.877039+00:00",
  "metrics": {
    "acceptable_difference_count": 0,
    "blocked_case_count": 0,
    "capture_limitation_count": 1,
    "case_count": 13,
    "correlation_gap_count": 0,
    "denominator_definition": "evaluated_in_scope = executed_case_count - (out_of_scope_count + capture_limitation_count + human_baseline_unsupported_count + domain_coverage_gap_count)",
    "domain_coverage_gap_count": 5,
    "domain_model_gap_count": 0,
    "exact_frame_match_count": 1,
    "exact_match_count": 0,
    "exact_match_rate": 0.0,
    "executed_case_count": 13,
    "false_negative_count": 0,
    "false_positive_count": 0,
    "human_baseline_unsupported_count": 0,
    "median_absolute_frame_delta": 0.0,
    "needs_adjudication_count": 6,
    "orchestration_gap_count": 0,
    "out_of_scope_count": 1,
    "procedure_match_count": 1,
    "procedure_match_rate": 0.1667,
    "protocol_coverage_gap_count": 0,
    "stage_match_count": 0,
    "stage_match_rate": 0.0,
    "unsafe_correlation_count": 0,
    "within_1_frame_count": 1,
    "within_3_frames_count": 1
  },
  "python_version": "3.12.10",
  "skill_versions": {
    "5gc-failure-boundary": "0.2.2",
    "5gc-handover-mobility": "0.1.1",
    "5gc-pdu-session": "0.4.2",
    "5gc-registration-mobility": "0.2.6",
    "c-pro": "0.2.0",
    "core-network-pcap": "0.1.0",
    "cross-protocol-evidence": "0.1.0",
    "gtpu": "0.1.1",
    "linux-troubleshooting": "0.2.0",
    "nas-5gs": "0.2.1",
    "network-engineer": "0.2.0",
    "ngap": "0.3.2",
    "pfcp": "0.1.1",
    "procedure-evidence": "0.1.0",
    "protocol-reverse-engineering": "0.2.0",
    "sbi-http2": "0.2.1",
    "systematic-debugging": "0.2.0",
    "wireshark-analysis": "0.2.0"
  },
  "tshark_version": "TShark (Wireshark) 4.7.1 (v4.7.1-0-g667ab240e6de)."
}
